post_id,title,link,content,write_time,recommend,comments
326226,중국 춘추전국시대 보물 수준,https://gall.dcinside.com/board/view/?id=dcbest&no=326226&_dcbest=1&page=1,"2500년전, 중국악기 편종  춘추전국시대 초나라 제후무덤에서 출토. 2500년전  초나라 한자가 새겨져있는 모습    세계문명 발상지 중(이집트, 인더스, 메소포타미아, 중국)  중국만이 살아남아서 고대문자를 계승한 유일한 나라 전국시대(B.C 475~221)  음식담는 청동기 그릇. 중국 청동기 부장품 , 기원 전 771-476년.     봉황과 용이 몸체에 , 받침대는 4 마리의 용이 떠받침.  뚜껑은 두 겹의 연꽃 위에 학이 서있어 '연꽃과 학의 청동기'로 알려짐.   중국 춘추시대, 기원전 771-476년.   소의 형상을 한 특이한 모양의 청동 술병. 2500년전 초나라 제후무덤 칠기문화재.   신삼국지/ 초한지 등 중드사극 단골 아이템.  짐승 2마리+ 새 2마리 Mix 실내 인테리어용 중국칠기.  맨밑  짐승 + 몸통  새 +  사슴뿔 백조같은 새 2마리 + 사슴뿔  고대 중국의 인테리어 칠기. 2100년전 한나라시절,  마왕퇴 무덤에서  사치품 칠기가 한무더기 발굴  고구려 무덤벽화( 무용총, 각저총 등)  왕실, 귀족층도 수입해서 사용 술병 담는 검정칠기 Box  B.C 1000, 주나라    고대중국 제사때 손씻는 청동기 대야  호리병박 자른 몸체 + 용 손잡이. 벌레? 짐승??  춘추전국시대  칠기. 출처: 싱글벙글 지구촌 갤러리 [원본 보기]",01:15,84,"['근데 결국 걔내들도 전부 중국아님? 결론은 중국은 위대하다구나. 장문으로 알려줘서 ㄱㅅ', '아님 이민족이니까 중국은 명송 정도뿐이없음 나머진 전부 다른 민족', '황하 문명은 다른 문명에 바해서 1000~2000년 뒤쳐져있음ㅋㅋㅋ 기원전 1900년 정도임 이집트나 메소포타미아 문명같은 경우는 기원전 3000년전~ 4000년전 ㅇㅈㄹ인데 짱깨새끼들이 4대 문명이라는 병신같은 소리로 억지로 끼워넣은거임 ㅋㅋㅋ 연대기만 놓고보면 황하문명은 마야문명이나 안데스문명쪽임ㅋㅋㅋㅋㅋ 그시절이면 전세계에 다들 문명 하나씩은 보유중ㅋㅋㅋㅋ', '그래서 서양에선 세계 4대문명이니 그런 단어는 존재하지 않음ㅋㅋㅋㅋㅋ', '청나라때 만들어진 개소리기 때문임ㅋㅋㅋㅋ', '단군조선 bc2333도 날조란다 ㅋㅋㅋ 역사가 제일 주작이 많은 학문', '별거 없네 ㅇㅇ\n\n백제금동대향로 수준', '이런 걸 문혁 때 존나게 박살냈다는거지??', '그럼 머하노 문화연속성이랑 게승이란 측면에서 왕조만 바뀌면 그전에 문물죄다 반달되고 다 파괴되고 리셋되서 첨부터 시작하는걸 최근엔 문화대혁명이후 유교제례 조차 안남아서 한국와서 배워가고 ㅋㅋㅋㅋㅋㅋ', 'ㄹㅇ 사람 취급 안하던 농민들 먹을거 없어 반란 일어나면 식인종 되서 부촌, 상업도시 쳐들어가서 싹다 잡아먹음 ㅋ\n한나라 이후 역사가 이거 도돌이표 ㅋㅋ', '다 이민족들이 전수해주고 남긴 것이잖아 - dc App', '저런거는 당시에 아떻게 만든거냐 걍 망치로 두드리면 펴지고 구부러짐?', '중국은 춘추전국시대처럼 갈라져 있었으면 더 발전했지 통일된 중국은 최악', '철기 시대 bc1000인데 청동기 만지는거 보면 황하 존나 후달리네', '그럼 지금 2000년대인데 목재 건물 지으면 후달리는거임?ㅋㅋㅋ', '짱개는 콘크리트 건물 조차 아직도 제대로 못짓는 거 보면 후달리는게 맞지', '백제금동대향로 이기는건 아직없네', '저때부터 한나라 지나서 유관장 나오는 시대까지 그리고 우리나라로치면 삼국시대까지 인간을 갈아넣는 시대라 저런게 나온거긴함', '윤두창', '한국에는 석가탑 수원 화성있다 장난하니?', '미개한 좆자 ㅋㅋㅋ', '그냥 망했는데 뭔 계승한 유일한 나라임 ㅋㅋㅋㅋ 진짜 역사도 짧은 나라들 뻥튀기 시켜서 헐도록 빨아주는게 중국 종특인 듯. 그나마도 원래 쎘던 나라들 지들 역사로 편입시킴 그 시대 있던 헐도록 빨던 나라 덜 빨음 ㅋㅋㅋㅋ 영토 크기도 바뀌고. 개그가 따로 없지', '문혁으로 다부셨다매??', '어차피 뿌셔뿌셔 당한답니다', '고대에서 이어져 내려온것도 아니고 현대에 다시 제작한건데 뭔 ㅋㅋ', '세계문명 발상지에 황하문명 넣는건 짱깨들만 주장하는 병신이론인데?', '금동대향로 미만 잡', '존나 미개해서 계승할문자도 없었잖아 ㅋㅋㅋㅋㅋ 짱깨새끼들 문자를 만들생각도안해 시발 ㅋㅋㅋㅋㅋㅋ 세계의 암덩어리답다', '중국이 고대 4대문명 이지랑 다른 이집트 메소포타미아 문명들이랑 2000년 가까이 발상년도 차이나고 그리스 정도랑 비슷한 시기 문명이구만', '기원전 초나라 문자가 지금까지 이어져서 세계 유일 고대 문자 전승 ㅇㅈㄹ\n그당시 로마 문자는 지금까지 전해지는 걸로 모자라 세계 공용어 영어로 쓰이고 있구만\n짱깨 갑골문이랑 페니키아 문자랑도 발생년도 200년도 차이 안나는데\n짱깨문자는 시대에 뒤쳐진 병신 그림 글자 페니키아 문자는 세계 모든 문자의 기초가되는 표음문자 알파벳임\n짱깨 마저도 키보드 칠때 알파벳으로 먼저치고 지네나라 글자로 변환함', 'ㄹㅇ 씨발 비빌걸 비벼야지ㅋㅋㅋ', '한국 짱깨 제외 교과서에서 세계 4대문명 이지랄하는 나라가 또 있긴하나', 'ㄹㅇ 짱깨들 존나 깝침', 'ㄴ4대문명 일본에서 미는거다...', '다 중국산 짝퉁임', '주변국들꺼 약탈한것도 포함', 'ㅈ되노', '팩트) 지금은 좌좀1찍 공산당이 다 파괴해서 남아있는 유물이 없다', '다른 문명은 발전된 문자체계를 받아들였는데 짱깨만 걍 계속쓴다 이말 아님?', '하지만 현실은 시진핑 개새끼도 못하는, 자유도 없는 좆병신 바퀴벌레국', '그런데 지금은 왜 개지랄중임? ㅋㅋㅋ 쓰레기 씹짱깨들이 그 위에서 살뿐이지 저 유물들은 한족역사가 아니야 ㅋㅋㅋ 그래서 모택동 씹쌔가 문혁으로 다 태워버린거고 ㅋㅋ 개병신 쓰레기 한족 짱깨들아 ㅋ', '세계문명 발상지 중(이집트, 인더스, 메소포타미아, 중국)\n중국만이 살아남아서 고대문자를 계승한 유일한 나라\n<<<<<짱깨는 앞 세 문명하고 비교도 안 되게 초라했다는거 이미 다 까발려졌는데 언제적 4대문명 운운하노 전교조새끼들 폐해가 크다', '황하문명을 저 세 문명하고 엮어서 동격으로 가르치는 나라는 현재 전 세계에서 중국하고 한국밖에 없음ㅇㅇ', '고대 유물들은 현재 짱깨와 관련없잖아. 한민족이랑 관계가 깊지', '월왕구천검이 없네 - dc App', '2500년전이면 한반도는 단군왕검이 2천살 생일파티 하던때에\n\n중국은 초나라세우고 철기문화 가지고있었노', '문명의 발상지?', '진짜 고유물 맞아? 쟤네는 저런것도 조작할 가능성이 커서. 믿을수가 있어야지', '2500년된 문자 아직도 처쓰고있는게 자랑이냐 엠창 짱깨새끼들아 으휴..분서갱유는 왜처했고?', '효과적으로 지배하기위해서 이전의 사상을 지우는\n작업이지 단지 중국은 그스케일이 클뿐\n마오시절에도 문화혁명해서 다지워버리잖아? 글짜까지 쉬운버전 간체로 바꿔버린 대혁명이지 그로인해 과거 문화를 지우고 문맹율 즉 까막눈 사람들이 사라졌지 그럼으로 공산사상을 빠르게 뿌렸고 이건 단지 중국뿐만 아니라 어느정도 교육을 통해서 적용시키고있어. 교육과정을 통해서 말이지 - dc App']"
326224,응급실에 실려간 형,https://gall.dcinside.com/board/view/?id=dcbest&no=326224&_dcbest=1&page=1,엄마 : 맴버는 늘~ 똑같지 ㅋㅋ 출처: 해외야구 갤러리 [원본 보기],01:05,142,"['병신', '남의일이니까 재밌지', 'ㅄ같긴한데 인생 재밌게 사네 ㅋㅋㅋㅋ', '보통 10,20대때 남자들이 사고로 많이 죽어서 자연스럽게 성비가 같아진다고 함.', '쟤는 30대야...', 'ㄴ살아남은거지', '그런 모험심이 없는 집단은 크게 성장하지 못하거나 점진적으로 축소되었기 때문에 유전자 레벨에서 남성에게 모험심을 강요하는거다...', '에미 말투부터 주작인데 시발 어휴', '저걸믿냐? 인증도 없는데?', '가스파드같노', '무슨말하는지 모르겟다', '지능이 좀 낮은거 같은데', '주작도 이런 개 씹주작이 다 있네 개새끼야 좆같다 씨발 이런걸 왜 퍼오고 지랄이냐 개씨발 수준 여기가 로룰릐류러냐? 씨발년아', '그래서 다마스 성인 남자 3~4명이면 엑셀밟아도 안나가가냐?', '겠냐 공차900 적정적제300키로에 과적 꾸역꾸역해서 굴리던 찬데', '저게 인생이지', 'ㄵ', '귀엽당', '웃기긴한데 남자 어쩌고 하면서 병신짓 한다는 밈 미는 이유가 뭐냐', '병신짓이라는 편견을 버려', '본문 별개로 모가지 뻣뻣한 여자꼰대들이 항상 하는 말 있잖아 뭐 만하면 남자는 철없다~ 등등', '뭔 검정고무신도 아니고 괴짜가족도 아니고 저렇게 사이가 좋노', '다마스 드리프트', '저건 그냥 병신이지 결혼 못하고 유전자 안남기는게 세상에 득이다', 'ㄹㅇ 서양 쇼츠에 나올거같은 유쾌함이네 ㄷㄷ', '이거 무슨 영화 그거 같노\n\n멤버들 모여서 대신 미친짓해드립니다 하듯이 미친짓하는거 ㅋㅋ', '형이 ㅂㅅ이긴하네 - dc App', '잭에스 ㅅㅂ ㅋㅋㅋ - dc App', '나도 병신짓 많이 했는데 급이 다르네 저건 ㅋㅋㅋㅋㅋ', '예스마이로드 <- 유쾌한척 하는 영포티 틀니감성', 'ㄹㅇ', '주작', '정말 재밌다', '이 좆병신은 매달다의 사전 정의를 모르는 것인가?', '다마스가 아무리 병신차여도 43마력인데 씨발 성인 남자 3명이 민다고 안밀리면 그게 차냐 ㅋㅋㅋㅋㅋㅋ', '으하하 남자들이 빨리 죽는이유!! 어머니 완전~~해탈 ^^;;', 'ㅋㅋㅋㅋㅋㅋㅋㅋ ""또 왜""가 나오네. 어지간히 지랄맞은가봄', '김치판 잭애스 ㅋㅋㅋㅋㅋㅋㅋㅋㅋㅋㅋㅋㅋ', '잭애스 추억이다 ㅅㅂ', '이걸어케참음ㅋㅋㅋㅋ개재밋겟네', '이게 재밌냐 병신들아', 'ㅇㅇ개꿀잼핵잼인데????', 'ㅇㅇㅋㅋㅋ 왜 모름? 혹시 우울증임?', '예스마이로드 <<< 믿으라고 이걸?', '현대 문명이 자연선택 막았노', 'ㅋㅋㅋㅋㅋㅋㅋㅋㅋㅋㅋㅋㅋㅋㅋㅋㅋ인생재밌게사네 - dc App', '아들만 있거나 아들을 더 많이 낳은 여자 = 강철멘탈, 모성애 MAX, 밀프\n\n\n\n딸만 있거나 딸을 더 많이 낳은 여자 = 유리멘탈, 모성애 ZERO, 애새끼', '결론 : 유교의 남아선호사상은 옳은 것', '근데 ㄹㅇ 아들맘들은 강하게 살아가는 느낌이 있는데 딸맘들은 뭐 맨날 피해자 역할? 그런거밖에 안나오는듯\n나너무 슬퍼 ㅠㅠㅠㅠㅠㅠ 하고 딸도 엄마 너무 불쌍해 퓨ㅠㅠㅠㅠㅠㅠㅠㅠㅠㅠㅠㅠㅠㅠ 이런거밖에 못봄 미디어에서', 'A, B에서 병신... 이랬는데 C, D가 니들이 좆밥이라고 하고 똑같이 저 지랄했다는데서 빵 터짐 ㅋㅋㅋㅋ']"
326220,"부산 재건 힘썼던 위트컴 장군, 부산대서 충혼비 논란",https://gall.dcinside.com/board/view/?id=dcbest&no=326220&_dcbest=1&page=1,"부산 재건 힘썼던 위트컴 장군, 부산대서 충혼비 논란 6·25 전쟁 충혼비 건립 불투명https://www.chosun.com/national/2025/04/28/LXM7EPJMNZAM3J25QJ7DJ74VP4/ 부산 재건 힘썼던 위트컴 장군, 부산대서 충혼비 논란부산 재건 힘썼던 위트컴 장군, 부산대서 충혼비 논란 6·25 전쟁 충혼비 건립 불투명www.chosun.com반대측이라는 작자들 말 꼬락서니 하고는 진짜 사상이 의심스러운 수준이네 학내 이념 갈등 유발하는 계획 철회하라” “위압적인 비석 건립을 반대한다”고 했다. “일방적 영웅화’는 안 된다"" “다른 정치적 의도가 있는 것 아니냐” “(6·25 전쟁에서) 피해자·가해자의 경계가 모호하다” “선배들이 낙동강 전선에서 북한군 수백 명을 죽이지도 못한 것으로 안다. 영웅도 아닌데 무슨 비를 세운다는 것이냐”   ‘공론화 과정 부족’ “보수 정부가 추진하는 기념비가 ‘부마 민주 항쟁’의 성지인 부산대에 들어올 수 없다” “부산대 참전 동문들에게 ‘통일의 적’이라고 비난하는 것도 들었다” - 부산대 출신 6.25 참전용사, 전화 인터뷰에서 출처: 새로운보수당 갤러리 [원본 보기]",00:45,116,"['똥부산 요즘 조용하노', '남침 유도하고 남의 나라에서 전쟁해서 수백만 갈아놓고 건물 지어주면 위인이야?', '구체적으로 미국이 어케 유도해서 빨갱이들이 남침하도록 유도했는지 설명 좀 해봐라 나도 궁금하다 이기야', 'ㄹㅇㅋㅋ', '그런 논리면 일본제국이 진주만 폭격한 것도 미국이 유도 한거잖아 ㅋㅋㅋ', '김정은 딸래미년 토실토실 떡감좋은 바디 덩실거리면서 유혹하는데 이거 북침 강간 유도하는 그린라이트지? 레이더에도 안걸리는 초대형드론타고 주석궁 방에 잠입해서 존나 따먹어야지~ 대가리에 대검 쑤시면서 돼지년 딸래미 멱따는 소리들으면서 피스톤질 존나 마렵네 ㅋㅋ', '역시 전라도새끼답네', '?', '사실상 부산대도 만들어준 사람이구만 뭔 빨갱이새끼들이 ㅋㅋ', '학생 전체는 반대 하나도 안 함. 부산대 총학이 배급견 빨갱이에 부산대에도 시나징이 좀 있어서 바퀴벌레 더듬이발작하는 거. 철거 될 일 절대 없음 ㅋㅋㅋㅋㅋㅋ', '저런 새끼들이 매국노지', '안봐도 전라도 출신', '중국하고 역사관 맞춰야지zz', '부산대 좆잡대새끼들은 빨갱이가 설쳐도 반박하나 못하고 조용히 있음ㅋㅋㅋㅋ 지방대의 수준이 딱 저런 에피소드에서 드러나는 거다. 서울대였으면 좌빨하고 정상인하고 존나게 서로 싸웠다 최소한', '이걸 또 빨갱이들이 ㅋㅋㅋㅋㅋㅋㅋㅋㅋㅋㅋㅋㅋㅋㅋㅋ', '좌익 이 씹새끼들 - dc App', '저 씨발 50년대 똥통이던 조센에 정칙해 살생각한사람한테 한다는짓거리가 어휴 - dc App', '저런 개병신짓하면서 학교 망신 시키는 새끼들 교통정리하는게 총학생회 역할인데, 부산대 총학도 그짝인가보네 가만히 있는 거 보니', '이미 한국인들은 625때 받은 은혜에 대한 고마움은 지옥 밑에 처박아두고 잊어먹은지 오래임. 오히려 고마움을 증오로 승화시켜 가는중', '병신 러뽕 장애인새끼 이새끼 고구려대 노어무역학과 나온 쉬는 백수 38세 애미 오열하다 푸틴 애미 따라감', 'ㄴ 이 또라이새끼는 도대체 어디서 뭘보고 러뽕 지랄 떠는거임? 이 글 어디에도 러시아의 ㄹ 자도 안나오는데? 요즘 정병새끼들은 개소리로 어그로 끄는 알고리즘 같은거 있나', '챗gpt도 모르냐? 인터넷 개통 축하한다ㅋㅋㅋㅋ', '어딜가든 한국인이 위험에 처한걸보면 절대 구해주지마라 은혜갚긴커녕 은인한테도 칼들이미는 족속이니 짱깨를 구하는게 더이득', '점령군 미군 수괴놈 동상을 왜 세워주냐', '你这是什么意思？ 你上次不是说你不会忘记天安门而且必定找回民主主义吗', '天安門 天安门 法輪功 李洪志 Free Tibet 劉曉波', '막말로 이겨서 점령군 소리 듣지 짱깨새끼들은 2000년간 오입질만 하고 뚫지를 못했으니 억울할만 해ww', '역시 민간인들이 미군장성 잡아다 인민군에 넘긴 전라도새끼는 생각이 다르네', '온나라가 걍 빨갱이 밭', '이쯤 되면 그냥 인정해야 됨. 조선인에게 은혜를 베푼다=병신임 ㅇㅇ', '개잡대 다 됐네', '전국민 사상검증 시급하다. 이승만대통령때 사상검증해서 포로교환 잘 끝난줄 알았는데 꼭 구라까서 기어남은 시키들이 꼭 있네 북으로 보내자', '좆팔육 <---- 이 최악의 세대 중에서도 교수 + 법관 + 의사 이 세 집단은 재활용 불가능한 농도짙은 쓰레기들만 모여있는거 같음', '간사하기 짝이 없어 신의를 지켰다는 이야기를 들은 바가 없다', '짱깨새끼들 바글바글하다 ㅋㅋㅋ', '간첩이 득실득실하노', '또 씨발 세금으로 삽질하고 있네', '빨갱이들만 반대', '교수랑 법관은 임명하기 전에 사상검증부터 해야할듯', '부산경남지역 필두 대학은 부경대학교다', '부산대 진짜 미쳤네 저걸 반대한다고?', '이 나라는 망하는게 맞음', '똥도 미국똥이면 먹을 족속들때문에 나라망한다던 박정희 대통령님 말이 맞으셧네', '짱깨똥먹는 이씨조선의 후예왔네', '저 반대 단체는 중국인들인가 아니면 중국 돈 받아먹는 자들인가', '똥푸산 빨갱이가 만선이노 ㅋㅋㅋㅋㅋㅋㅋ', '우리나라 위해서 한 일이 우리 나라 애국자들 몇 명 합친거보다 더 많은 분인데 국적을 떠나 존경이 마땅하지. 이걸 반대 한다고?', '반대하는새끼들 이름부터가 ㅋㅋㅋㅋ\n한국 ""비정규교수"" 노동조합 ㅋㅋ 여기들어가있는놈들 대부분 시간강사들임 ㅋㅋ', '진짜 고마운 사람이네. 근데 인간들이 저렇게 못됐나.', '한국인 맞나?....']"
326218,알쏭달쏭 전남대학교 에타촌,https://gall.dcinside.com/board/view/?id=dcbest&no=326218&_dcbest=1&page=1,경북대도 그렇고 이쯤되면 지거국에 뭔 마가 꼈나출처: 싱글벙글 지구촌 갤러리 [원본 보기],00:35,227,"['ㅋㅋㅋ 유쾌하노', '핫걸이엇다노 ㅋㅋㅋ', '존나 재밌게놀긴하네 ㅋㅋㅋㅋㅋㅋㅋㅋㅋㅋㅋㅋㅋㅋㅋㅋㅋㅋㅋㅋㅋㅋㅋㅋㅋㅋㅋㅋㅋㅋㅋㅋㅋㅋㅋㅋㅋㅋㅋㅋㅋㅋㅋㅋㅋㅋㅋㅋㅋㅋㅋㅋㅋㅋㅋㅋㅋㅋㅋㅋㅋㅋㅋㅋㅋㅋㅋㅋㅋㅋㅋㅋㅋㅋㅋㅋ', '영화 ㅅㅂ ㅋㅋㅋㅋㅋㅋㅋㅋㅋㅋㅋㅋㅋㅋㅋㅋㅋㅋ', '가끔 저런거 보면 저게 다 커뮤에서 관심과 웃음을 먹고사는 불쌍 한 사람 한명이 다 쓴게 아닐까 하는 생각이 들음', '줘도 안가는 지잡대주제에 어딜 유쾌한척은 하네.ㅋㅋㅎㅎ', '쓰레기같은새끼들', '이런새끼가 사실 지잡대임', '개쌍도였으면 여자 강간할 작당모의만 올라왔을텐데 전라도라서 흥쾌하구나\n개쌍디언들도 전라도 사람들을 본받아서 중국의 큰 마음가짐을 가져서 속좁은 짓거리 좀 안 하길 바란다', '의외로 호감이네 다른데보다', '개웃기노 ㅋㅋ', '만갤이네 그냥ㅋㅋㅋ - dc App', '경북대 에타는 병신ㅋㅋㅋㅋㅋ 느낌이면 전남대 에타는 병신느낌이네', '어린홍어 ㅋㅋㅋ', '영화가 존나 웃기네 ㅋㅋㅋㅋ', '여기 댓글창 분석해보니까 90%는 웃고 넘기는데\n한 10%가 뿔나있네\n\n전남대도 못간 고졸빡통쌍도인으로 추정됨!', '전남의 ㅆㅃㅇ - dc App', '나라 정상화되려면 코로나 5번더 오고 똥팔육들 좀 디지고 10년쯤 지나야할듯', '존나 웃기노 ㅋㅋㅋㅋㅋㅋ', '전라도인데 의외로 다른 지역들보다 멀쩡하노 시발 ㅋㅋㅋ', '이런거보면 정치충, 틀딱들이나 지역감정 들먹이지\nmz들은 그냥 다 만갤분위기네 ㅋㅋㅋㅋ 영화는 시발 ㅋㅋㅋㅋㅋ', '만갤은 쓰레기통이자나', '역시 대한민국의 미래는 MH세대가 이끈닼ㅋㅋㅋㅋㅋㅋㅋㅋㅋㅋㅋㅋㅋㅋㅋㅋㅋㅋㅋㅋㅋㅋㅋㅋㅋㅋㅋㅋㅋ', 'ㄴㅁㅎ은 뭔 과목임? ㅋㅋㅋ', '홍어새끼들 웃기노ㅋㅋ', '전라도새끼들이 인서울 흉내내네', '라도 MH세대 장래가 기대되노 ㅋ', '어 올해는 중력절 기념하고 열흘있다 이재명 찍으러갈거야ㅋㅋㅋㅋㅋㅋ 과메기 어저미들 설렜노?', '디시질하면서 간만에 호흡곤란오면서 웃음ㅋㅋ', '아가야 매일매일 하루를 늘리는게너무부지런하고커여웁구나 - dc App', '전부 전라디언들이네', '영화는 보긴 봐야지ㄹㅇㅋㅋ', '노무현~나웃겨 ㅋㅋㅋㅋㅋㅋ', '느금보고 터졌네 씹 ㅋㅋ - dc App', '이새끼들이 [이마트]도 못 간다는게 사실임? ㅋㅋㅋㅋ 심지어 망해가는 [홈플러스]도 없다는 그 지역?! ㅋㅋ', '아 시발 나도 전남대 갈걸ㅋㅋㅋㅋ', 'ㅈㄴ 유쾌한데 ㅋㅋㅋㅋ', '메디컬 드립은 진짜 웃겼다 ㅋㅋ', '시험 끝나고 영화보여주는게 국룰이긴하지ㅋㅋㅋㅋㅋㅋㅋㅋㅋ', '여기 리부트갤러리 주딱 대학임', '안궁금해', '아기 홍어들 귀엽노', '전라도에 중도가 있음?? 좌파소굴아님??', '미친새끼 ㅋㅋㅋㅋㅋㅋㅋ', '지거국goat', '출산중인거 존나 웃기네 ㅋㅋ', '홍어 ㅋㅋㅋㅋ', '홍어도 못막는 mh세대ㅋㅋㅋㅋ', '외국인새끼들 한국어 잘하노', '그치만 홍어는 싫은걸...']"
326216,싸우면 질것같은 외국누나,https://gall.dcinside.com/board/view/?id=dcbest&no=326216&_dcbest=1&page=1,출처: 국내야구 갤러리 [원본 보기],00:25,187,"['이새꺄 가오떨어지게 너클은 씨발 ㅉㅉ', '현실파악 못하고 한번 해보고싶다 꿈꾸는 좆만한 실베충 똥양남들 존나 웃기네 사람으로도 안볼듯ㅋㅋㅋ', '며칠사이 야윈넣얼 달래애고 멀어져간 싸아람아', '자지빨리면 요도까지 다빨리겟뇌ㅣ', 'ㅅㅂ 여자가 194 100kg면 걍 슈퍼솔저 아니노 ㅋㅋㅋ 한남이 아니라 양남들도 줘팰듯', '동양인 애기 임신하면 임신한줄도 모를듯', '싸움은 질지 몰라도 ㅅㅅ하면 내가 이김', '본인 170/61 인데 보찌한방에 보낼수있음', '원펀치에 사망하겠네 시발\n무서워서 밖에 나가겠냐? - dc App', '힘도 암내도 ㅈ될거 같다', '그래 정정당당히 정면에서 싸움? 내가 질 수도 있지...\n하지만 삶은 투쟁이다.\n내가 저자를 무조건 이겨야 한다. 죽여야한다. 끝장을 내야한다. 라면 이야기가 달라지지...\n대로변에서 사람들 사이에 섞였을 때 등 뒤에서 단도로 불의의 습격을 가한다면 과연 나를 이길 수 있을까?', '애휴 우매한놈아 저년 걍 레스링식 서브미션 태클걸어서 얼굴 뷰지에 푹파묻고 넘어질때까지 질주하면 그 뒤로는 내 해피타임의 시작인데 뭔 단도여', 'ㄹㅇㅋㅋ 해줄 줄 아느냐\n버러지같은 것이 내 말에 토달지 말거라 발정난 짐승새끼야 ㅉㅉ', '미친놈이야 이거 - dc App', '전 여자친구 격투기 선수였는데\n\n국내경기 나간ㅇㅇ\n\n술쳐먹고 빡쳐서, 내 팔 존나 쌔게 쳤는데, 그떄부터 팔 나감.\n\n여자친구한테 티내면 넘 쪽팔려서, 말안하고 끙끙앓으면서 2주동안 지냄. 시발;;ㅋㅋ', '운동좀 해 좆밥새끼야..', 'ㄴ 찐따가 할소린 아님ㄷㄷ\n\n애초에 운동같이해서 만나게 된거임.\n\nㅋㅋ 찐따야, 형이 댓글 달아줬다ㅎㅎ', '긁힌티가 많이나시네 리플리증후군 환자라 그런가?ㅋㅋ', 'ㄴ 리플리거나 160/90 여친한테 깔려서 다쳤는데 격투기 선수라고 뻥카쳤거나', '박는순간 정복감 오질듯', '진짜 하고싶은말이 한가득인데 인간으로서 존엄성을 생각해서 참는다 ..', '와 194 존나 크네', '어지간한 남자들은 야스하다 기 다 빨리겟노', '내게 권총이 있었다면 이겼을거요', '계집은 심각하게 좆빕임', 'ㅋㅋㅋ미쳤네 그냥 여전사네', '2세낳으면 피지컬 최강이겠노 ㅋㅋㅋ', '저 정도면은 얼굴도 평타치고, 괴안아 보이네 ㅋ', '헉? ㅋㅋㅋㅋㅋㅋㅋㅋㅋ 이젠 여자들 파워가 장난 아닌데? 그래도 아직은 아님 ㅋㅋㅋ', '미안한데ㅋㅋ 카프킥 누적데미지 쌓으면 골골 거릴거같은데? 거인종특이 하체와 연골이 빈약함', '저 사람이 카프킥 맞아줄 생각만 하고 저 다리 길이에 너가 카프킥 쳐맞을 생각은 못하노 도태남아/ㅋㅋㅋ', '실베충들 저 여자 만나면 바로 쫄아서 아무말도 못할텐데 온라인이라고 센척 오지네', 'ㄹㅇㅋㅋ 실제로 보면 그냥 열등감에 짓눌려서 숨도 못쉼ㅋㅋㅋ', '자기소개 잘 들었어들', '산사 스타크랑 싸우면 누가 이길까', '산사 게이는 그냥 배우잖아', '질것같은이 아니고 무조건 지는데', '키가 저렇게 큰데 얼굴은 평범하네 개사기노', '와.... 이건 절대 못이길듯', '귀쌈뱅이를그냥 올려벌라....튀어도 잡히려나', '194는 못이기는거 맞다 일단 체중부터 80이상일듯', '여자상위 1프로 이런게 아니라 여자라는 생명체들 중에 지구상에서 젤쎈 여자에 가까울듯', '존 존스 피지컬이네', '씨발년 개꼴리네 보지에 존나 박고싶네', '저런 여자보면 정신 못차릴때까지 착즙 당하고싶음', '체급부터 헤비급이네 ㅎㄷㄷㄷㄷ', '뷰지 발로차보고 싶다..', '자박꼼', '꼴려', '와 뒷치기하면 정복감개쩔겟다']"
