post_id,title,link,content,comments
326084,"SKT 쓰는 임원, 빨리 바꿔라"" 대기업도 '비상'…커지는 불안",https://gall.dcinside.com/board/view/?id=dcbest&no=326084&_dcbest=1&page=1,- 관련게시물 : SK 대국민 사과 요약- 관련게시물 : 안싱글벙글 SKT 대고객 발표문 뜸출처: 국내야구 갤러리 [원본 보기],"['무플 3추 실베', '쵸마마 쵸마마마', '인증기능 다막는게 맞지.. 털리면 보상해줄수는있고..?', '호들갑 그만 떨어라 별일도 아닌데', '어떻게 나라 통신망이 털려서 국민 절반이 하루아침에 유심난민 신세가됐냐 ㅋㅋ', '윤석열같네 - dc App', '??? : 유심 다 보상해주면 회사 부담이 심해져', '나여 최태원', 'ㅆㅂ LG,KT야 물들어올때 노졌자. 정책좀 후딱 풀어라 내가 당장 이동한다 온가족 할인 X까고 확 낮추면 오늘 바로 번이 한다', '유심 털려서 무료로 바꿔주는건데 선심쓰는척 하네', '털어간 짱꺠 새끼들은 민좆당이고 욕은 국민이 먹어 ㅅㅂ ㅋㅋ', '사고 친 놈들이 바꿀 필요없다 = 무조건 바꿔야 됨', '찢재명과 공산민주당은 대체 머하노? ㅋㅋㅋㅋㅋㅋ 다수당은 머하노? ㅋㅋㅋㅋㅋㅋㅋㅋㅋㅋㅋㅋㅋㅋㅋㅋㅋㅋㅋㅋㅋㅋㅋㅋㅋㅋㅋㅋㅋㅋㅋㅋㅋㅋㅋㅋㅋㅋㅋㅋㅋㅋㅋㅋㅋㅋㅋㅋㅋㅋㅋㅋㅋㅋㅋㅋㅋㅋㅋㅋㅋㅋㅋㅋㅋㅋㅋㅋㅋㅋㅋㅋㅋㅋㅋㅋㅋㅋㅋㅋㅋㅋㅋㅋㅋㅋㅋㅋㅋㅋㅋㅋㅋㅋㅋㅋㅋㅋㅋㅋㅋㅋㅋㅋㅋㅋㅋㅋㅋㅋㅋㅋㅋㅋㅋㅋㅋㅋㅋㅋㅋㅋㅋㅋㅋㅋㅋㅋㅋㅋㅋㅋㅋㅋㅋㅋㅋㅋㅋㅋㅋㅋㅋㅋㅋㅋㅋㅋㅋㅋㅋㅋㅋㅋㅋㅋㅋㅋㅋㅋㅋㅋㅋㅋㅋㅋㅋㅋㅋㅋㅋㅋㅋㅋㅋㅋ', '개씨발롬들 ㅋㅋ']"
326083,롯데 우승까지 유튜브한다는 아로치카 근황..jpg,https://gall.dcinside.com/board/view/?id=dcbest&no=326083&_dcbest=1&page=1,개꼴데 1승당 10만원 기부오늘까지 160만원..앞으로 더 늘어날예정 ㅋㅋ출처: 롯데 자이언츠 갤러리 [원본 보기],"['ㅁㅈㅎ', '보통 한 6~80승 하지 않음? - dc App', '정보) 롯데는 한 시즌 35승을 한적이 있다.', '아느 그런 아웃 라이어 말고 - dc App', '롯데 우승까지할거면 올해까지만 유튜브할 생각인가? 올해가 각인데', '얘 평생 짱깨 부하였던 이순신갖고 지 딸 dna타령하던 반일좆포티네', '몸에서 김칫국물 냄새나는 새끼가 씨부리는 뽄새 하곤 ㅋㅋㅋ', '센순신 광신도가 긁혀서 거품물어봐야 이게 팩튼데 뭐 ㅋㅋㅋㅋ 더불어서 일본인한테 죽었고 저새끼나 너나 거짓우상숭배에 미친놈들이지 ㅋ', '갓데인데 승리 당 기부? 집안살림 거덜나겠네', '나도 황칰 우승할 때 까지 취업안한다고 모두에게 선언했음\n올해 통합 우승 느낌이라 취업 준비중', '이거 유튭보니까 초반엔 안그랫는데 요즘엔 휘둘리며살더라ㅇㅇ 이게 여자는 남자를 베타로 만든다는말인듯', '치바! 롯데! 마린-즈!', '무쳤다 킹갓데면 1000승도 가능하잖아', '아로치카 진짜 매력있더라 나도 저런 연애하고 결혼하고 싶다', '야로치카가 누구임? - dc App', '그러면 나중에 늙어죽어도 딸이랑 손주대까지 유튜브 계속 이어가야겠는데', '이름이 왜 저럼']"
326081,오늘 아침에 일어났던 청주시 고등학교 사건에 대한 기사,https://gall.dcinside.com/board/view/?id=dcbest&no=326081&_dcbest=1&page=1,"- 관련게시물 : 청주 고교서 흉기난동 발생https://n.news.naver.com/mnews/article/417/0001073742 ""이성 문제로 불만""… '청주 고교 흉기 난동' 학생 가방엔 흉기 가득충북 청주 한 고등학교에서 흉기 난동 사건이 발생해 6명이 부상을 입었다. 28일 뉴스1에 따르면 이날 오전 8시36분쯤 청주시 흥덕구 한 고등학교 복도에서 특수교육 대상 학생 A군(17)이 다수의 교직원을 향해 흉n.news.naver.com기사에 따르면, 당초 가해자는 특수학급 소속인 줄 알았으나 확인해보니 그건 아니고 일반학급에서 생활하는 특수교육대상자라고 함분노조절장애가 있었고, 평소 이성 관계 문제가 있었다고1~2일 정도 지나면 더 정확하고 상세한 전후 사정 및 정보가 나올듯- 등교 전 가방에 흉기 4개 챙긴 청주 고교생 흉기 난동범…https://naver.me/5KbgoMYo [속보]등교 전 가방에 흉기 4개 챙긴 청주 고교생 흉기 난동범…사건 발생 고교는 휴교 안 해28일 학생 흉기 난동이 발생한 청주의 한 고등학교에서 경찰 등이 사고 상황을 파악하고 있다. 연합뉴스 충북 청주의 한 고등학교에서 흉기 난동을 벌인 특수학급 학생이 범행 전 다수의 흉기를 소지한 채 등교한 것으로 naver.me- 흉기 난동 학생, 차량 운전자도 찔러 ... 아이들 노렸다출처: 더불어민주당 갤러리 [원본 보기]","['허.. - dc App', '또 통합이냐', '말을 어렵게 써놨는데 특수반에 가야할 애를 일반교실에 편성했단 뜻이잖아? 요즘 애들 무개념 장난아닌데 특수반이면 한 10배쯤 감당하기 힘들지', '병신갤 바로 비추', '우영우', '재매이햄 되면 저런 놈들 다 드럼통행임', '대머리 또 1패ㅋㅋ', '호민했네', '우영우 살처분 렛츠고', '저런애들 걍 놔두면 조현병으로 발전해서 공공장소에서 불지르고 칼부림 낸다.', '어쩌라고', 'ㅋㅋㅋ 벌써부터 이러면 어떡하냐 우영우세대 아직 풀려나지도 않았는데 ㅋㅋㅋ 노괴 자식들 쏟아져나올텐데', '특수반 장애불량품=예비범죄자 맞음. 심지어 그 대머리새끼 아들도 저질렀잖음', '어쩔', '우영우 살처분안하노 ?', '이젠 ""특수"" 붙은 사건 나오면머머리이야기는 뺴놓지않고 등장하노', '저수지 오염되기 전에 잘 건졌네', '어쩌라고 씨발새끼들아', '갱생도 안되는 쓰레기들은 좀 죽여라 사회에 풀어놓지 말고', '이래도 통합이 옳은거냐???? 개인 소수를 위해 모두가 희생하는게 옳은거냐?', '좌우 무관하게 개추주는 공정한 갈베햄이야', '근데 라도국 일상거리 소내 아님?? 저런게 뉴스로 뜨네', '아 청주였구나 ㅇㅎ', '장애인새끼답게 1킬도 못하고 갔노 병신새끼 적어도 여교사 한명 정도는 1킬은 했어야지 ㅋㅋ', '시바 특수반이 장애아들이 아니라 문제아들 모아둔 곳인가보네', '우영우 생산공장 가동! ""우리애는 부족한게 아니고 특별한거에욧!!""', '앞으로 특수부모가 일반학급에 다니게 하고 싶으면 세금 10배 내는 법안 통과시켜라 피해나 사회적 비용 너무크다 시발 선생도 두명이나 더필요한데 말이되냐???', '이러고나서도 일반학급가라하겠지 - dc App', '이성문제.. ㅋㅋ', '걍 비정상적인 성욕문제라고 해야지', '청주 양아치 도시라 어린 애들도 분위기 씹양아치임', '음흉도\n광주사람들도 음흉도는 학을 뗀다', '미개한새끼들 장애인을 보듬어야지 쓰레기새끼들 니들이그러니깐 밖에쳐 쳐맞는거야 찐따새끼야', '장애인을 보듬고 싶으면 장애인 부모가 세금 더내라 그게 합당한 세상이다', '똑같이 니들가족한테 업보로 간다 씹새끼들아', '전라북북도', '리틀원종이 빨리 감빵에 집어넣어라', '걍 빠져죽게 냅두지. 저걸 또 꺼내내', '정병 새끼들 요즘 왤케 많냐', '이성문제 ㅋㅋㅋ 한녀 못 잃어~', '그러니까 한녀못잃어 하는게 본능이 너무 강해진 우영우임\n\n우영우 팩토리 한녀는 대한민국이 포기하는 게 맞다', '앞으로 노산 한녀들때문에 저런애들 많아질텐데 어쩌냐', 'ㅋㅋㅋㅋㅋㅋ 본능이 훨씬 강해진 특수학급 장애인이 이성에게 까이면 현실에서 칼찌\n\n우영우 생산공장 한녀를 포기하는 게 최선의 선택이 맞음', '바지 수시로 벗어제껴서 교사한테 한소리했다고 교사 고소해버린 어떤 인간의 새끼 미래네 - dc App', '앞으로 훨씬 심해질거란거지 2018년 18%였나 그 애새끼들이 2025년에 7살이니 2035년엔 고등학생\n\n지금 기사 우영우처럼 본능이 강해진 유인원되고 이성에게 거절당하면 저렇게 분노로 무차별 칼찌', '보니까 자폐나 경계선 지능 그런게 아니고 정신질환 있어서 특수교육 대상자 이런건가본데?', '자살할꺼면 소방관이 구출하기쉬운곳에서해라...', '슉슈슈슉슉슉', '1찍들이 만든 세상', '촉법 박살낼 수 있는 사람은 이재명 뿐인듯']"
326078,준비란 물량까지 동났다...어르신들 공략한 매력적 제안,https://gall.dcinside.com/board/view/?id=dcbest&no=326078&_dcbest=1&page=1,https://youtu.be/q7R2JBBXfns?si=arXWVQMDKgqjMT4t [자막뉴스] 준비한 물량까지 동났다...어르신들 공략한 매력적 제안 / YTN행정복지센터 민원 창구에서 어르신이 신청서와 함께 운전 면허증을 반납합니다.곧바로 돌아오는 건 버스를 타거나 편의점 등에서 물건을 살 수 있는 교통카드와 두툼한 봉투.봉투에는 시장에서 쓸 수 있는 온누리 상품권 40만 원어치가 들었습니다.65살 이상 어르신이 운전 면허증을 반납하고...youtu.be50만원 배급 드가자 ㅋㅋㅋ 출처: 이론 갤러리 [원본 보기],"['지금은 운전면허 취득과정이 간소화됐으니까 그렇지 예전에는 면허 취득교육만 한달 이상 걸렸어 강도도 높아서 합격률도 30%도 안됐어', '운전 개판인 새끼들 봐라 다 야매로 따니까 그렇지', '50이든 100이든 수십년 잘 썻으면 된거지\n뭐 그럼 그동안 운전한거까지 공짜였어야 함?', '쉽게 바뀌기 전에 학원에서 따면 100가까이 들었음', '중국에서 원정 오는 비행기값 포함이냐?', '특)받을거 다 받고 무면허로 운전함', '그럼 깜빵에서 평생 썩고 뒈지는거', '설명도 필요 없는 병신 빨갱이국 ㅋㅋㅋ', '반납안해 시발 테슬라 자동운전 곧이야', '맞음 반납안하고 있으면 이제 로봇이 자동으로 움직여주는 자동차 운전대만 살짝 손대고 탈수있음 주차까지 로봇이 다', '혼자뒤지는건 상관이없는데 자꾸 젊은애들 치어죽이니까 65세이상은 면허 강제반납시켜야함 - dc App', '65세면 현역이야 븅신아', 'ㄴ너 65세냐', '65세면 댓글도못달게 해야됨 - dc App', '65세 이상으로 강제하면\n택시 버스 서비스 걍 셧다운임 ㅋㅋㅋㅋ - dc App', '젊은애들 일자리도생기고 좋노 - dc App', 'ㄹㅇ루요', '그냥 박탈을 하면 되지 저게 다 우리들이 낸 세금임 ㅅㅂ - dc App', '그건 민주주의에 어긋남. 우리는 궁전제도가 아님', '박탈하는데 드는 비용이면 상품권 좀 뿌리는게 윈윈임. 뭣하러 쓸데없이 세금낭비하냐?', '어짜피 차 없던 사람들은 걍 개꿀 - dc App', '손귀익할매는 87세인데 존나 힙하노 ㅋㅋ', '시골살거면 운전면허 반납하면 안됨', '이거 반납하면 면허 말소됨?', '당연한거 아니냐', '온나라가 배급 천지놐ㅋㅋㅋㅋㅋㅋㅋㅋㅋㅋㅋㅋㅋㅋㅋㅋㅋㅋㅋㅋㅋㅋㅋㅋㅋ', '조센징은 자진반납 이런 행위 자체가 불가능한 족속들이다. 강제로 박탈하는게 맞다.', '손귀익 할머니는 이름이 고려시대 장수같노 ㅋㅋ', '틀딱들 급발진도르로 사람 치어 죽일땐 면허 면허반납하라고 지랄하고\n반납하면 세금나간다고 지랄하고\n\n좆버러지 씹센징들은 못말려ㅋㅋ - dc App', 'ㄹㅇㅋㅋ - dc App', 'ㅋㅋㅋ면허반납하는건 좋은데 수십억씩 쓰는건 좀 글킨함', 'ㄴ 여가부 페미년들 아가리에 돈꼽아주는거보단 저게 훨나음 - dc App', '면허 뺏어야지 ㅇㅇ 돈을 왜 줘 틀딱 배급견 새끼야', '전국민이 배급견 좆버러지새끼들인데 일방적으로 반납하라하면 잘도 반납하겠다 븅신새끼야ㅋㅋ - dc App', '돈이 썩어넘치노 ㅋㅋㅋ', '좋은 건데 시발 돈 퍼주니까꼴받네', '꼴받으면 빨리 65세 되세욧', '손 할머니 테레비도 나오시고 꾸민 보람 있으시노ㅋㅋ', '걍 70세 넘으면 박탈시키라고', '당연히 해야하는걸 왜 세금을 풀어줌? 걍 강제 압수로 법을 바꿔', '쵸마마 쵸마마ㅏ마', '장농면허 반납하고 50만원 챙김...\n허나... 저런 시골은 차없으면 존나 불편함', '평소에 운전하는사람은 절대 반납안하고 평소에 운전 안하는사람만 돈받아가는중ㅋㅋ - dc App', 'ㄹㅇ루뇨.....', '배급의 나라', '시발 얼마전에 셀프주유소에서 어떤 틀딱이 계속 반복해서 쳐 누르길래 그냥 셀프주유소 처음인가? 하고 가까이 가서 도와주려는데 ""잘 안 보여서~"" 이러면서 경유/휘발유 써있는것도 안 보여서 그러고 있는거였음 ㅋㅋㅋㅋㅋㅋㅋㅋ 존나 무서워서 기름넣자마자 풀악셀로 도망갔다', '배급견 싱글벙글', '저 돈 받아서 교통비 몇달치나 된다고? 시골이라 버스도 ㅈ같이 안올텐데 아무도 안 받을듯 ㅋㅋㅋㅋ', '노인 교통비 대부분 하잖음', '배급묘 냥냥냥~']"
326077,첫해외여행&혼여 오사카-교토 5박6일 후기,https://gall.dcinside.com/board/view/?id=dcbest&no=326077&_dcbest=1&page=1,1일차 - 간사이 공항 도착하고 난바역에 짐맡긴담에 해유관으로 바로 출발함 고래상어 생각보다 막 엄청 크진않은듯?? 얘 이름은 머르겠는데 귀여웠어 2일차 -아침일찍 오사카성 갔다가 우메다가서 이치란라멘먹고 포켓몬센터랑 닌텐도스토어 들름 그후에 나라가서 국립박물관에서 칠지도 구경했음 사진금지인게 아쉽 그 후에 도다이지랑 나라공원감사슴 진짜 개무서움 유튜브보면 양손번쩍들면 먹이없는줄알고 물러간다는데 그거 구라임 3일차 - 오사카 엑스포에서 하루보냄 근데 진짜 대부분이 걍 화면에 영상틀어주고 자기 나라 홍보하는게 대부분  건담은 짱큼 4일차 - 유니버셜 스튜디오 싱글라이더로 어지간한건 한개씩 다 타보고 돌아온듯 해리포터 성이 ㄹㅇ 개이쁨 5일차 - 아침에 무기토 멘스케 가서 라멘먹고 교토로 이동 교토역에서 버스 타고 은각사까지 간 다음 쭉 걸어서 철학의길 -> 헤이안신궁 -> 니넨자카 -> 산넨자카 ->기요미즈데라 -> 교토역 이렇게 돌아옴 마지막 6일차 - 첫차타고 후시미이나리신사 첫차타고 가니까 사람 거의 없어서 좋았음 정상찍고 내려오니까 사람 바글바글하던 고양이가 귀여워요 근데 고양이 왜 많음 이나리신사 다 보고 다시 오사카 난바로 돌아와서 오코노미야끼 먹음 후에 공항갈때까지 빈시간에 덴덴타운 갔다가 복귀 개힘들었다 수요일 걸음수 체크안된거까지하면 17만걸음정도 걸은듯 - dc official App출처: 일본여행 - 관동이외 갤러리 [원본 보기],"['기동력 미쳤네', '걍 이제 오사카 갈바에 경주감', '한해 관광적자로 외화유출만 100억달러\n\n매년 외화 14조이상을 그냥 가져다줌\n\n일본여행 천만시대 달성\n\n환율 나라탓 하면 안된다', '했어?']"
326074,대구 북구 노곡동 함지산서 산불 발생…인근 주민·등산객 주의,https://gall.dcinside.com/board/view/?id=dcbest&no=326074&_dcbest=1&page=1,"https://m.yeongnam.com/view.php?key=20250428020263053 [속보] 대구 북구 노곡동 함지산서 산불 발생…인근 주민·등산객 주의28일 오후 2시 1분께 대구 북구 노곡동 산39 일대에서 산불이 발생했다 오후 2시 14분 당국은 입산을 금지하고 인근 주민과 등산객에게 안전사고에 주의하라는 안전안내문자를 수도권을 제외한 지역신문 중 가장 오래된 역사를 가진 지역 일간지 영남일보입니다. 방문에 감사드립니다.m.yeongnam.comhttps://www.gukjenews.com/news/articleView.html?idxno=3261776 [속보] 대구 노곡동서 산불 발생...주민·등산객 주의대구에 산불이 발생했다.22일 대구 북구에 따르면 이날 오후 2시 1분 경 노곡동 산39에서 불이 났다.이에 인근 주민과 등산객은 안전사고에 주의해달라고 당부했다.www.gukjenews.com- [속보] 대구 북구 함지산서 산불…헬기 5대 동원 진화 작업https://n.news.naver.com/article/088/0000944603?sid=102 [속보] 대구 북구 함지산서 산불…헬기 5대 동원 진화 작업28일 오후 2시쯤 대구 북구 노곡동 함지산에 불이 났다. 소방당국은 헬기 5대를 비롯해 차량 24대, 인력 69명을 투입해 진화 작업을 벌이고 있다. 사상자는 아직까지 발생하지 않은 것으로 알려졌다. 북구청은 이날n.news.naver.com- 또 산불이야이게 뭔...  - dc official App- 대구 또 불난다고 난리네 대피명령 뜸- 대구 현재 산불난 위치저 뻥뚫린데가 산이냐? - 산불… 경북대 근황…jpg- 실시간 이거뭐노윤활준비 마쳤는데 산불 나서 헬기 겁나 날라댕기는데 ㅎㄷㄷ 소방관분들 화이팅입니다출처: 스카이 갤러리 [원본 보기]","['대구수준ㅋㅋ', '화짱조 씹세끼들아', '쪽매친 씹새끼들아', '대구거지들은 세상에도움이안되노', '게이야 논리적으로 생각해봐라 이기 대구에 침투한 화짱조 홍어 공작원이 방화했을 가능성이 523%아니겠노?', '배급타먹으려고 불지른 대구거지일확률이 1557%정도노', '김대한 선생님께서도 화짱조였다는거냐!!!!??', '게이야 더 논리적으로 생각해봐라 이기 대구에 침투한 쪽매친 공작원이 방화했을 가능성이 518%아니겠노?', '게이야 합리적으로 생각해보면 30만원으로는 부족해서 100만원 달라하려는 개쌍디언들의 음모가 아니겠노?', '발끈하는 짱개 ㅋㅋ', '전라도 씨발놈', '경 상 도 - dc App', '통구이들 보상금 노리고 또 불지르네', '백종원 밥해주러 저기 가남?', '프랑스 화재가 먼저다', '대구 끄덕끄덕', '일부러 지르는게 맞음', '백종원 출동 ㅋㅋㅋㅋㅋㅋ', '쌍도 대구 민도', '도곡동도 아니고 노곡동에서 불 난 걸 굳이 알아야되냐', '아 뭐야 ㅜㅜ 우리나라 뉴스인줄 알았잖아 ㅎㅎ 우리나라 뉴스가 아니라 다행이다', '경북 대형산불 방화 2건 불구속했잖음\n\ncarry on~', '짱깨 또 너야?', '쪽바리 또 너야?', '대 구', '경북 수시로 산불주의문자 날라오던데 뭔 의미있노 ㅋㅋㅋ 정상인은 짜증만 나고 흡연충이나 소각충은 ㅈ까라하고 그냥 지맘대로 불질러버리는데', '이제 재미삼아서 산불 일으키네..', '밎좆당 짱깨 새끼들이 또', '경상도는 짱개 흉노족', '쪽바리 새키들이 또', '경상도 2찍 저능아새끼들은 진짜 병신 쓰레기들임ㅋㅋㅋㅋ', '화짱조아님?', '쪽친매 아님?', '산불 난지 얼마 됐다고 또 산에 쳐들어가서 불 피움? 정신병자 ㅅㄲ들인가? ㅋㅋ', '중국인 소행일듯', '일본인 소행일듯', '견상도는 남탓해서 발전이 없다 걍 그대로 도태돼라', 'ㄴ 발끈하는 짱개 ㅋㅋ', '불의도시 원조답구나', '타는 냄새 난다 ㅋㅋㅋ - dc App', '타는냄새 ㄷㄷ', '저기서 쓰레기 태우는 미친 놈은 못 봤는데\n누가 담배피다가 불 낸 듯', '그 지역', '개쌍도 대구새끼들은 수틀리면 불지르잖아', '4합 사진 반갑네 ㅋㅋㅋㅋ', '지금 터지는 것들은 백퍼 흡연충들이지 ㅋㅋㅋㅋㅋㅋㅋㅋㅋ', '담배값 한 3만원으로 올려서 거지들은 못피게 만들어야지', '대구? 흠.. 저거 끄는데 드는 비용 당연히 대구시민 개인계좌에서 빼서 쓰는거 맞지?\n에이 설마 애국보수 대구경북인들이 세금으로 끄진 않을거 아냐 ㅋㅋㅋ', '짱깨들 요즘 전방위 공격하노 천벌받을 새끼들 - dc App', '활활타서 최대한 고통스럽게 죽어라\n가난하고 낙후된 지방충 개쌍도 개씨발 천민 세금날먹 기생충 지방충 씨발새끼들아\n여기 서울에서 보면 너네는 분리독립해서 죽여버려야할 주적이니까\n제발 서울 기어올라오지말고 느그나라 좆지방에서 평생 쳐박혀 썩다가 고통스럽게 뒤져~~~~']"
