post_id,title,link,content,comments
326041,⑤8박9일 도쿄-고치-나고야 여행기,https://gall.dcinside.com/board/view/?id=dcbest&no=326041&_dcbest=1&page=1,"[시리즈] 8박9일 여행기 시리즈 · ①당신의 고치 여행이 조금 더 즐거워 지기를 바라며 - 료마패스포트 · 고치에서 갔던 음식점들 총정리 · ① 8박9일 도쿄-고치-나고야 여행기 · ② 8박9일 도쿄-고치-나고야 여행기 · ③ 8박9일 도쿄-고치-나고야 여행기 · ④ 8박9일 도쿄-고치-나고야 여행기 오늘은 민주화관, 니이다신사, 류이치 요코야마 박물관을 가기로 했다역시 시작은 고치역 앞 노면전차 승강장모닝누오 하이어쨌든 아침 먹으러 이동한곳은 珈琲館 デポー 京町店맛있는 고치모닝을 맛볼 수 있다가격도 꽤 괜찮은편이고 점심메뉴들도 괜찮더라어쨌든 나는 고치모닝 PART4랑 아이스커피 50엔 추가해서 먹었다한산한 노면전차난 데스카 발급받아서 찍고 타고다녔다자유민권기념관내부는 사진촬영 대부분 사진촬영 금지내용이 좀 어려워서 번역기 허락을 맡으니 번역기는 OK라고한다퀴즈같은것도 있는데 다 하고 접수처가서 정답 맞냐니까 본인들도 몰라서 가서 확인하고 다시 알려줌하는사람들이 많진 않은듯..ㅋㅋ한시간정도 관람하고 버스타고 하리마야바시 인근으로 이동여기서 버스를 타고 니이다 신사로 이동 할 예정노면전차와 차도가 함께있는 이국적인 풍경그건 그렇고 고치는 코카콜라 간판이 굉장히 많더라버스를 타고 내려서 니이다 신사로 가는 길한적하다 아니 사람한명 없음풍겨오는 봄바람에 편승한 섬유유연제 냄새가 참 좋더라10분정도 걸어서 도착한 니이다 신사평일이라 아무도 없었다 여름에는 풍경 및 풍등으로 꾸민다고 한다테미즈야는 생화를 띄워놔서 이뻤음매달 초순에 꽃을 띄우는 행사를 한다던데 이게 물속에 있어서 시들지 않은건지 모르겠네니이다 신사 본당이곳 역시 사카모토 료마와 관련이 있는 신사. 주변 11개의 신사를 합병하여 다양한 신들을 모시고 있는 곳이라 비는 소원도 가지각색인 곳적당히 건강을 기원하고 목적을 향해 이동그것은 가츠오 오미쿠지300엔으로 낚시대를 이용해 가츠오 오미쿠지를 할 수 있다!미쿠지는 직접 가져가도 되고, 신사에 매달아 놓아도 된다고 함나는 가지고 왔다대충 이렇게 걸어서 오미쿠지를 낚아야하는건데 은근 어려움ㅋㅋㅋ5분정도 끙끙대다가..우효www 월척 겟또다제뱃속에 운세종이가 접혀져 들어가있다다행히 길떠서 가져왔음방문국가 KOREA에 스티커 하나도 없는거 1호로 붙혀주고 왔다대만은 직항이 있어서 그런지 외국 방문객중에서는 최다 ㄷㄷ근데 고치로 돌아갈 버스 시간이 한참남아서 짱박히기로 함..그래도 갤럼들 여행하는거보면 이정도는 많은 편근처 편의점 이트인 코너에서 잠깐 쉬다가 버스타러 돌아갔다한정거장 더 가서 내려도됐더라..다시 잡긴 늦었고 걸어서 이동했다저 계단타고 가거나 뒷쪽 에스컬레이터 타고 3층인가 가면 요코야마 류이치 박물관2층은 요코야마 류이치 관3층은 야나세 타카시 기획전 중이었음중간중간 사진 안되고 3층 기획전관은 아예 안됨'그건그렇고 우리도 신문에서 몇십년동안 4컷만화 나오던게 있었던거 같은데..요코야마 류이치의 행적을 볼 수 있었다재밌었음당시 살던 자택을 구현한건데 퀄이 상당하다 ㄷㄷ거기에 음성도 나와서 보는맛이 있었음이건 1월~12월까지 실렸던 만화로 달력같이 만들어 놓은 것바를 너무 좋아해서 자신의 집에 바를 직접 만들었다고 한다이 또한 상당한 퀄리티에 놀랄수밖에 없었다주딱이 좋아하는거3층은 호빵맨 작가 야나세타카시 기획전인데 사진을 아예 찍을 수 없는 곳호빵맨 그림체만 봐서 몰랐는데 그림실력과 필력이 상당하시더라 ㄷㄷ어쨌든 다보고 고치역으로 이동요사코이 박물관 가고싶었는데 휴일이라 못갔음..슬슬 퇴근시간이라 차들도 많아졌다
고치역 앞으로 무사복귀호텔에서 좀 쉴까했는데 다음날 아침부터 나고야로 이동해야 하기때문에 일찍부터 한잔하기로고치역 앞에 있는 이자카야 토사구토금지 표지판이 인상적이다 이곳은 무조건 술과 안주가 맛있다일단 오토시와 나마로 목부터 축여주기주문한 가츠오 타타키, 벌써 고치와서 4번째 먹는다그래도 떠나면 이 맛을 못느끼니까 먹었음개인적으로 가장 맛있게 먹었던 타타키칼로리 보충용으로 에비칠리도 하나 시켜줌이쯤에서 맥주도 다 마셔가니 옆자리 젊은분한테 고치사람이냐고 물어보며 이자카야 스몰톡 시작이런저런 얘기하다가 롤 얘기도하고, 버튜버 얘기도하고, K4SEN얘기도 하고, 일본 직장얘기 등등 다양하게 했음아니 근데 깻잎논쟁 얘기를 어케아는지 그런것도 물어보더라 ㅋㅋㅋ 도대체 어케아는거임?첫잔으로 추천받은 54호프루티한 맛이 좋다고 해서 추천받았는데 맛있었다들어보니 지금은 사이타마에서 일하며 살고있고, 그 전에는 가나자와에서 일했다고 함수습기간이라 뭐 휴가같은게 나와서 시코쿠돌고 올라가는거라고 하더라한시간넘게 떠들다가 주인분도 합세해서 같이 놀았음고치에 꽤 한국사람들 오냐니까 가끔씩 온다고함그다음으론 CEL-24, 산로쿠 한잔씩 마신듯? CEL-24 강추함떠나기전에 같이 셀카 한장서로 핸드폰으로 한장씩 찍었음자긴 한국인들 말 없이 과묵한 타입이라 무서웠는데 한국사람 말 이리 말 많은지 첨 알았다함..모두 나 같은건 아니겠지만 무서워보여도 말 걸어주고 말 함께 하다보면 다들 좋은사람일거라고 얘기해줌다음엔 자기가 먼저 한국사람에게 말 걸어보겠다며 얘기하고 헤어졌음 이렇게 마시고 4시간 버스타고 다음 목적지로 떠난다더라 ㄷㄷ하긴 장시간버스 탈때는 술이 최고긴할듯그 뒤로 가고싶었던 니혼슈바로 갔는데 휴무일;;아아악!!기본으로 깔리는 분탄소금을 뿌려서 제공해주길래 물어보니까 단맛이 더해진다고 함수박같은 느낌인듯?대충 근처에 있는 케쥬얼 바에 들어옴비정기적으로 DJ나 가수분들이 와서 라이브하는 음악펍느낌의 바안주류는 이렇게도 있고 카운터에 보면 그날그날 안주도 있다난 배가 좀 찼으니까 속 보호용으로 베-콘에그 주문맥주 하이볼 가장 자신있는 칵테일 두잔인가 마셨음이거 사채꾼 우시지마에서 봤는데..호스트 편이었는데 꽤나 암울했던 내용이었는데 어쨌든 여기서도 한시간 반정도 재밌게 얘기하다 갔음요사코이 축제 같이 방값 보다가 충격받고, 이때가 아이묭 인천 입국했을때라 아이묭 얘기하면서 음악얘기좀 하다가내가 SUPERBEAVER 좋아한다니까 무슨곡 좋아하냐해서 らしさ 좋아한다고 하니까 바라카몬 이야기 해주더라 ㅋㅋ오 나도 재밌게 봤다하고 애니얘기좀 하다가 최근 한국에서 인기있는 일본가수 레이나 얘기해주니까 모르더라.. 근데 노래좋다고 자기도 들어본다함고치막날.. 여기서 마무리로 함께 재밌게 놀고 나옴다음이 언제가될지 모르겠지만 이상한 한국놈이 이 사진 보여주면서 다시 돌아오면 그때도 잘 부탁한다고 얘기하고 고치에서의 모든 일정 종료확실히 대도시보다는 적당히 큰 도시가 난 좋다다음에 다시보자 고치야출처: 일본여행 - 관동이외 갤러리 [원본 보기]","['다음은 가고시마를 가도록', '후 담엔 고구마소주 마시러 가고시마로 가야지\n여름은 빡셀거같아서 가을이나 겨울쯤 가야겠음ㅋㅋ', 'ㄷㄷ', '아니 엔저일때나 갈만한나라지;; 지금같을때는 갈메리트 하나도 없는나라가 일본임;;', '한해 관광적자로 외화유출만 100억달러\n\n매년 외화 14조이상을 그냥 가져다줌\n\n일본여행 천만시대 달성\n\n환율 나라탓 하면 안된다', '다 한국에도 있지만\n불쌍한 일본놈들 외환보유고하고\n경기좀 살려줘야지', '으아 부럽다!', '걍 이젠 국내여행이 압승임', '거긴 날씨가 좋노']"
326039,싱글벙글 과거 1972년도 당시 서울과 도쿄의 모습,https://gall.dcinside.com/board/view/?id=dcbest&no=326039&_dcbest=1&page=1,서울도쿄저 때는 진짜 비교할 수 조차도 없는 어머어마한 넘사벽 차이였었노출처: 싱글벙글 지구촌 갤러리 [원본 보기],"['일본은 발전을 ㅈㄴ 못함 미개함', '도쿄 외곽은 서울보다 심했는데 몰랐노? ㅋㅋㅋ', '도쿄경제권 gdp 세계1위임 - dc App', '지금도 도쿄랑 서울 넘사벽인데 뭔소리노\n\n도쿄역 앞에만 가봐도 종로 초상위호환임', 'ㅇㅇ 90년대까진 비교 자체가 불가능했고', '지금 도쿄역 앞은 서울 어느 도심지를 가져와도 못비빔ㅋㅋㅋ', '너 평생 해외여행 일본 딱한번 가봤지 ㅋ 메이드카페에서 돈주고 사진찍은거 하루에 3번 생각하고', '잘 살고 못 살고를 떠나서 미감의 차이가 어마어마하다. 한국은 1990년대부터 빈곤을 면했고 2010년대부터 세계화됐으니까 그 이전 세대의 미감이란 아프리카 수준', '지금도 천박하고 거지같긴해\n\n일본 미감은 세계적 수준이고', 'ㄴ ㄹㅇ', '지금 화제인 청담동 오피스텔 건물이나 보고와라', '대황본\n\n센울도 원래 일본스타일일땐 이뻤어\n\n미개토인 센시인들이 다 때려부수고 센파트 도배해서 망한거', '미국이랑 비교해야지 차이가 심하지. 기와집 지붕 빼면 별 차이가 없네. 차라리 60년대를 비교해라', 'ㅇㅇ 70년대 딸이나 쳐', '지금도 저 정도 갭은 존재해', '위에 사진들만 봐선 차이 잘 모르겠는데 ?', '일본은 80년대부터 이미 2000년대의 삶을 살고있었다는 말이 있음', 'ㅇㅇ', '도로에 시발 차선이 없네', '지금을 유지할수 있으면 한국도 살기 좋은 나라지 근데 인력 갈아서 이렇게 됐는데 더이상 태울 연료가 없는데 뭘로 유지 시키냐???????????????????????????????????????????????', '그래서 나온게 AI임 미래는 AI로 대체되기 때문에 잘사는 나라는 망할일이 없음 저출산이다 뭐다 다들 호들갑임', '사진만 봐선 별 차이도 없구만\n눈이 썩었나..?', '응 차이 존나나 윤종아ㅋㅋ - dc App', '이런거보면 또느끼는건 조센징들 특유의 그 집요함은인정하긴해야함 이정도로발전하긴한건보면 - dc App', '? - dc App', '지금은 비교가 된다고 생각하네 ㅋㅋㅋ', '저런 일본을 한국 부동산 전체를 팔면 다 살수 있다는게 얼마나 웃긴 일인지 알겠지?\n\n빨리 아파트 설거지시키고 도망가라', '부동산으로 억지 gdp 올린걸로 일본땄다더라 ㅋ', '부동산이 오르면 gdp도 오르냐? 별', '일본 물 덜빠진 때라 저때가 난 더 예쁘다고 생각함.', '원종이 칼들고온다 모두 대피해라', '저때 한국은 흙퍼먹고 다녔잖아\n길바닥에 똥싸고 - dc App', 'ㄹㅇㅋㅋ - dc App', '누가보면 지금은 어마어마한 차이 없는 줄 알겠넼ㅋㅋㅋㅋㅋㅋㅋ\n지금도 어마어마한 차이야 미국과 멕시코 수준의 차이가 있는데 조센징들만 모름 ㅋㅋㅋㅋ\n똥서울 거지새끼들 일방적 도쿄 닮음호소 진짜 개웃기고 애잔함ㅋㅋㅋㅋㅋㅋㅋㅋㅋㅋㅋ\n도쿄에서 보는데 개웃김 걍 ㅋㅋㅋ', 'ㄹㅇ ㅋㅋ 우물안 센숭이들만 자기들이 일본이랑 비슷한 급이거나 오히려 위라고 정신승리 망상함 ㅋㅋㅋ', '그래봤자 서울은 중국 1선도시는 커녕 2선도시에 겨우 비비는 수준아님?', '그러게 저런 병신나라한테 소득을 왜따이노 ㅋㅋㅋㅋ', '소득을 왜따이노 ㅋㅋㅋㅋ (임금체불 100배를 찍으며)', '지금은 솔직히 서울이 도쿄보다 낫지\n\n원종이들만 부정하며 과거딸 치는거지 ㅋ', '짱깨 꼴페들 특징: 하루종일 실베에서 지가 글쓰고 지가 10초만에 대댓글 담ㅋㅋㅋㅋㅋ', '지금은 비교 가능해? 병신인가 ㅉㅉ', '그러네 ㅋㅋ 지금도 비교 불가 넘사벽 앞으로도 넘사벽인데.\n\n조센징은 주제를 모르는군', '""유전자"" 가 다르잖냐', '지금 도쿄 봐라 서울하고 수준차이 아직도 심함', '도쿄 여행 갔다 온 놈들 중에 ""서울이랑 별반 다를거 없던데?"" 이 지랄하는 새끼들 있는데 그 때마다 \'아는 만큼 보인다\' 라는 말을 실감하게 된다 ㅋㅋ', '왜구새끼들이 한국전쟁때 군수품 팔아서 꿀빤 결과지', ""저때'는' ??"", '미군 형님들에게 공습 뚜드려맞은지 30년채 안된 시점인데,\n복원 좀 치누?', '개서울 씹미개', '우리 대재명 수령님께서 다시 저만큼의 차이를 만들어주실거다 가만앉아서 기다려라 ㅋㅋㅋㅋㅋㅋㅋ 친짱하다가 돈은 다털리고 아무것도 안남은나라가 될거니까']"
326038,서울 여의도 파크원 건물 화재로 대피 소동…인명 피해 없어,https://gall.dcinside.com/board/view/?id=dcbest&no=326038&_dcbest=1&page=1,"https://n.news.naver.com/article/029/0002951097?sid=102 [속보] 서울 여의도 파크원 건물 화재로 대피 소동…""인명 피해 없어""서울 여의도 파크원 건물 화재로 대피 소동…""인명 피해 없어"" 서울 영등포구 여의도의 대표적인 랜드마크인 파크원타워에서 화재가 발생해 주요 증권사 등 입주사들 임직원들이 대피하는 소동이 발생했다. 28일 관련 업계에n.news.naver.com- 여의도 파크원 건물 불...500명 대피https://mobile.newsis.com/view/NISX20250428_0003156138 여의도 파크원 건물서 불…500명 대피인명 피해 없어…건물 3층 창고서 화재 추정mobile.newsis.com - dc official App출처: 스카이 갤러리 [원본 보기]","['자꾸 테러가 빈번하게 일어나고있다.\nCCP OUT - dc App', '저기 통일교 건물이라던데 ㄷㄷ', 'ㄷㄷ', '땅이 통일교', '개서울 통구이 노릇노릇', '통구이는 느그 똥대구고 ㅋ', '느그 타이페이101이랑 동방명주타워 좆됐단다 - dc App', '개서울 에비통구이 발작하노 ㅋㅋ', '팡쥬는 불날 건물이라도 있노??ㅋㅋ', '로짱 다니는 해괴사들 ㅈㄴ 쫄렸겠누', '아오 부자놈들 좀 죽으라고', '재앙이다 재앙이야', '저거 볼때마다 공사 언제끝나나 했는데 완성된 건물이었음 ㄷㄷ - dc App', '통일교 건물 ㅋㅋ', '코엑스에 이어서 파크원도? 냄새가 남 아주 - dc App', '중국애들이 불지르고 다님', '소방차 몰려오긴 했는데 뭐 연기나거나 그런건 없더라', '이렇게 짧은 기간 동안 비정상적으로 화재가 계속 나는데 시나징 간첩 같은 외부 요인이 없다는 게 말이 된다고 생각하나 병신 1찍 좌빨들은?', '디자인 개구려', '장중에 불ㅋㅋㅋㅋㅋ 증권회사 상황 ㅈㄴ궁금', '간첩색기들이 온 나라에 불지르고 다니네', '지난주에 코엑스도 불났잖아 이거 진짜 뭐 있는거 아님?', '짱 깨 조 센 징 치안개박살ㅋㅋㅋㅋ - dc App', '이건 테러임 얼마전에도 코엑스 저러더만', '스프링클러 작동했나? 다행이네', '찢 비기닝', '불이 크게나야되는데 이런식이면 불 계속 지르고 다님...', '6월 대선은 짱깨?', '똥서울은 왤케 가난하고 낙후됨? ㄹㅇ...', '두창아 너하나만 가면 되는데 왤케 구질구질 추잡하게구냐', '슬슬 서울에도 불 지르기 시작하죠?? ㅋㅋㅋㅋㅋㅋㅋㅋㅋㅋㅋㅋㅋㅋㅋㅋㅋ\n암튼 국가위기상황 아니니까 다들 가만히 앉아서 뒤지세요 ㅋㅋㅋㅋㅋㅋㅋㅋㅋㅋㅋㅋㅋㅋ 나거세 ㅋㅋㅋㅋㅋㅋㅋㅋㅋㅋㅋㅋㅋㅋㅋㅋㅋㅋㅋ', '또 화짱조냐', '아깝네. 부자새끼들 싹다 거지 만들고 죽였어야했는데. 만상일체 잿더미가 되거라 류인약화!!!! 만해! 잔화의 태도!! 북!! 천지회진!!!!!', '강남하고 여의도새끼들은 좀죽어라 돈도많은데', '건물 진짜 못생겼노 ㅋㅋㅋㅋㅋㅋㅋㅋㅋㅋ', '불 붙은 사진도 없는데 시발 ㅋㅋㅋ 속보임ㅋㅋㅋ', '개좇센 ㅋㅋ', '불 ㅇㄷ?', '나 오늘 여기 2시쯤에 갔는데 아무 일 없었는데 뭐임?']"
326036,"소녀상 모욕한 유튜버 급기야... ""한국에 성병 퍼트리겠다""",https://gall.dcinside.com/board/view/?id=dcbest&no=326036&_dcbest=1&page=1,- 관련게시물 : 싱글벙글 조니 소말리 근황- 관련게시물 : 빈곤빈곤 조니소말리 근황출처: 기타 국내 드라마 갤러리 [원본 보기],"['그게 머가 어때서? ㅉㅉ', '팩트) 팩트다', '팩트는 쟤가 성병 옮을 위험이 더 크다는거 ㅋㅋㅋ', '신안에 보내면 해결된다', '??? 니거 이름은 인자부터 말식이여...?', '한녀들은 좋다고 원나잇 해댈듯', '조선 수준이 쟤랑 정확히 똑같아. 죽이 아주 잘 맞는다. 그러니 계속 붙잡아두고 이러고 노는거 아니겠냐 ww\n\n이게 다 국격 급 떨구는 거란 사실도 모른채 그저 저열하잖아', 'ㅋㅋㅋ 한녀잘알', '한녀따먹으면 오히려 성병 더걸릴텐데 ㅋㅋ', '이왕 이렇게 된거 추방시키지 말고 하멜표류기급 대서사시 쓸수있게 추억 하나 만들어주자', '아직 한녀를모르네 이미 한녀들은 온갖 남자가 들락거려서 대부분 성병덩어리임', '걱정하지마 한녀 성병 OECD 탑급이야', '이미 퍼져 있는데 병신인가 ㅋㅋㅋㅋㅋㅋㅋㅋㅋㅋㅋㅋㅋ', '니가요?', '성병 퍼뜨리겠다 공언하면 안대줄거 아냐 ㅋㅋㅋㅋㅋ', '양놈 렉카들 소말리 소식알려주면서 조회수 낭낭하게 빨아먹더라 꿀은 남이 다 빨아먹노 ㅋㅋㅋㅋㅋㅋㅋㅋㅋㅋㅋㅋㅋ', '한남한테만 안대주는 한녀들 양남이면 성병을 퍼트리건 말건 자동 보픈할듯', '깜둥이 새끼 헛바닥 잘라서 내보내라', '북송드가자', '뭔가 어그로가 재미가 없네', 'ㅋㅋㅋㅋ이미 성병보유중이라 느그 깜댕이가 더 걸릴거다', '응 이미 성병덩어리야', '신안에 보내면 치료가 된다네 ㅋㅋㅋㅋㅋㅋㅋ 염전 치료', '추방에 입국금지를 할게 아니라 평생 조선에 묶어둬야지', 'ㅋㅋㅋ 추가 기소 드가자', '진지하게 신안에 보내면 해결가능하다는거임...', '저런놈이랑 해서 걸리는 애들은 솔직히 그냥 걸려도 되는거 아닌가? 그여자가 다른남자 퍼트려도 그남자도 뭐 결국 그런놈들이고', '극우 전 목사는 왜 나오노 ㅋㅋㅋㅋ 동성애 에이즈 제일 반대하는사람한테 ㅋㅋㅋㅋ', 'ㅋㅋ 한녀가 성병 산유국인건 모르노 ㅋㅋ', '병신새끼 한녀가 우습냐?ㅋㅋㅋ아 ㅅㅂ존나 웃기노ㅋㅋㅋ', '나는 이새끼응원함 개조센 사법시스템 한계가 어디까지인지보고싶음 ㅋㅋ', '뭐야 얘 왜 아직도 있는거냐', 'Nigro', '추방을 왜해\n지금상태로 계속 놔두면 말라죽을텐데 ㅋㅋㅋ', '저새끼 한국인이였으면 좌빨의 표본이였겠지 - dc App', '신안 ㄱㄱㄱ', '역시 2찍은 전세계 공통 정신병', '이거 테러예고 아님? - dc App', 'ㅋㅋㅋㅋㅋ', '걍 휴대폰 뺏어서 신안에 던져두면 조용히 사라질건데 ㅋ', '한국 여성들은 매주 흑인을 갈구한다 ㅋㅋㅋㅋ', '저 와꾸에 니그로인데 성병을 어케 퍼뜨림 ㅋㅋ', '하다하다 보룡인을 건드네.. 집 가기 싫은듯ㅋㅋ', '슬슬 사라질때 됐네', '이미 걸려있는데 병신인가? ㄹㅇㅋㅋ', '아직도 못나가고있노 범부쉑ㅋㅋ', '너가 한녀한테 옮는거야 병신 니거새끼야 ㅋㅋㅋㅋ', 'ㄹㅇ', 'ㅋㅋ 병신', '이미 역병이 퍼질대로 퍼진 곳에 감기바이러스 옮기겠다고 해봤자..']"
326035,4월 28일 시황,https://gall.dcinside.com/board/view/?id=dcbest&no=326035&_dcbest=1&page=1,하이라이트초록색 : 현상황에서 긍정적파란색 : 중립 또는 긍정 부정 혼재분홍색 : 현상황에서 부정적ㅡㅡㅡㅡㅡ ㅡㅡㅡㅡㅡ 엔비디아 ㅡㅡㅡㅡㅡ 애플 ㅡㅡㅡㅡㅡ 개슬라 ㅡㅡ ㅡㅡㅡㅡㅡㅡ 개추출처: 미국 주식 갤러리 [원본 보기],"['이새끼는 뭐 이지랄하면 지 주식이 오르나? 버핏이 이지랄한다고 돈 벌더냐?', '그래서 누구 조롱하면 됨?', '트좆', '애플봐라 절대로 미국안간다. 기본 몇천넘는 자동차나 자동화까지 고려해서 갈수있는거지', '협상자 없는 협상 ㄷㄷ', '부자들이\n보통사람들 세금 안낸다고 뭐라하는데\n난 백수인데\n주식거래세만 한달에 수십만원 수백만원 내는데\n이것도 세금 아니냐?']"
326033,유명 로판 작가 손 공개 대참사 ㄷㄷ,https://gall.dcinside.com/board/view/?id=dcbest&no=326033&_dcbest=1&page=1,출처: 역학 갤러리 [원본 보기],"['어느부분이 대참사임', '아이 족발집 사장 씨발새끼 잔털제거 안하고 삶았노', 'ㅋㅋㅋㅋㅋㅋㅋㅋㅋㅋㅋㅋㅋㅋㅋㅋㅋㅋㅋㅋㅋ', 'ㅋㅋㅋㅋㅋㅋㅋㅋㅋㅋㅋㅋㅋㅋㅋㅋㅋㅋ', '족발 시켰는데 시츄가 왔다', '개씨발 한녀평균 ㅋㅋㅋㅋ', '짱녀평균이겠지', '아니 뭐 작가가 뚱뚱하고 털 많을 수도 있지 ㅋㅋ 근데 뭐 파쿠리했다 그런건 작가한테 치명적일수도', '근데 이미 돈벌거 다 벌고 웹툰에 미국 일본 진출까지 함\n짱깨 쪽에서 저작권 소송 못걸고 독자들도 흐린눈 하니까', '짱깨가 소송 못건다는게 ㅈㄴ 웃기네 ㅋㅋㅋ', '아아- 동북공정의 [복수]다-...', 'ㅋㅋㅋㅋㅋㅋ 씨발 짱깨가 당할때도 있노 - dc App', '반지가 예쁘네요', '족발', '손은 가리는게 좋지 않겠노', '반지가 불쌍하네', '첫번째 야외인 것 보니까 윤석열 탄핵집회같네 ㅋㅋㅋ 진짜 페미=메갈=족발손 과학이네 과학 ㅆ발 ㅋㅋㅋㅋㅋ', '흑돼지족발 어우야', '어우씹', '위고비 맞고 피부과 다니고 성형외과 몇번가면 다 해결될 문제네. 돈이 없진 않을거고', '위고비 맞아도 존나 처먹으면 계속 찐다. 위고비도 한계란게 있어. 돼지년아', '정병 새끼야 애먼 남자한테 돼지년이라고 지랄하지 말고 효과있든 없든 알빠노? 저 인간이 위고비 맞고 살빼면 뭔 큰일남? 웃긴 놈일세', '그럼 저런 소설 못쓰게됨', '뭐라는거야 씨발', '저거 재밌게 읽었는데 파쿠리였어?', '그래도 페미요소는 안나왔던거같은데', '살쪘다고 페미노 너무하노ㅋㅋㅋㅋ', '요즘나오는 어지간한 로판들은 다 페미묻어있음\n그래도 저건 그런낌새는 없었음', '두꺼운건 둘째치고 늙', '손까지 살찔정도면 흠....', 'ㅋㅋㅋ 저런 돼지마라탕82키로들이 인터넷에서 허군날 페미밭갈이하고 자기 컴플렉스 타인한테 던지고 다니는거잖아 ㅋㅋ', '그와중에 짱깨나 조선족인가 보네 ㅋㅋㅋ\n반지 취향부터 손가락에 털봐라 ㅅㅂ', '아...', '스테락 ㅋㅋㅋ', '시발ㅋㅋㅋㅋㅋㅋㅋㅋㅋㅋㅋㅋㅋㅋㅋㅋㅋ', '오픈채팅방 성고게톡 에서는 응원합니다!', '랑야방 표절한거임?', '털 손톱 반지디자인 긴고아..씨발 거를타선이 없노', '뭐 어쩌라는거임?', '돼지목에진주목걸이 라는 말이 딱 떠오르겟노 ㅋㅋ', '좋은손이네 로맨스소설 쓰기에 최적화 되어있네', '축사 돼지의 넷카마 라이프.lanobel', '참사긴 하네', '반지보단 털이 더 돋보이노', '""족발을 시켰는데 로판작가가 왔다""', '????', '남자아님?', '로판 작가가 남자인거 들키면 매장당해', '이것도 굴찜 같은거야?', '반지 살려']"
